shakespeare and company;это - классика независимых книжных, то, чего вы, наверное, уже ожидали. париж, имена уолта уитмена, оскара уайльда и тысяч других поэтов контркультуры (по крайней мере, времен девятнадцатого века). шекспир и компания - культовое место, обязательная точка для паломничества всех, кто думает, что в париже можно не только целоваться под эйфелевой башней, но и думать о том, что вечный город не только рим, но и центр франции, что кроме собора парижской богоматери есть и кладбище père lachaise. после обязательного поцелуя (красной, красной помадой!) стекла вокруг могилы оскара уайльда и пары-тройки слез от общего великолепия ситуации - в книжный. топтать ногами те места, где смеялись, любили и жили авторы ваших любимых (или ненавистных) стихов.;https://upload.wikimedia.org/wikipedia/commons/b/be/Shakespeare_and_Company_bookstore%2C_Paris_13_August_2013.jpg;https://shakespeareandcompany.com
robert’s books;один из нескольких поводов выбраться из пряничного центра риги - крошечный магазин robert’s books. здесь можно найти ту самую нежную атмосферу небольших букинистических магазинов, где есть все, вообще. вся эта литературная вселенная размером примерно в среднюю двушку в москве, а помимо книг там еще есть столики (два), и много изображений разнообразных ворон. этот магазин, как и сама рига, для того, чтобы жить медленно, и время там всегда подыграет - цель-то благая.;https://www.scandinaviastandard.com/wp-content/uploads/2016/09/Roberts-Books-Riga.jpg;https://robertsbooks.lv
acqua alta;этот магазин в венеции - настоящая жемчужина в пыльном мешке (в буквальном смысле - пыли, настоящей, вековой, старинной, там более чем достаточно). возможно, самый по-настоящему нишевый из наших независимых книжных - в фейсбуке они предлагают фотографии местных котов, все объявления пишут рукой на бумажке, а двери расписывают не модные дизайнеры, а друзья владельцев. если вас когда-то называли барахольщиком (любой вариацией неодобрительного высказывания на тему - вечно тебе нравится какая-то ерунда бесполезная), вам туда. хоть раз в жизни, ном точно туда.;https://live.staticflickr.com/4254/35408269926_f8df2bab60_b.jpg;https://www.facebook.com/libreriaacquaalta/
el ateneo;возможно, самый известный из наших «lucky» книжных, этот магазин в буэнос-айресе - преобразованный театр. можно на несколько часов потеряться среди книжных полок, а потом, как будто случайно, выйти на сцену, где столики, превосходный кофе, и множество возможностей для актерской игры - как будто я вот такой смешной человек, зашел в один из самых прекрасных книжных, на другом краю мира, поверил своим глазам и не разочаровался - такое и вправду бывает. ;https://www.thebubble.com/wp-content/uploads/ateneo-grand-splendid-5.jpg;https://www.atlasobscura.com/places/el-ateneo-grand-splendid
livraria lello;этот книжный магазин в городе порту в первую очередь замечателен своей архитектурой: построенный в 1906 году, он выполнен в стиле ар-нуво, таком, как рисуют в самых правильных учебниках мхк - прекрасные леди на стенах, текучие цветочные мотивы, сглаженные углы. вместо потолка - витражное окно, которое увеличивает градус возвышенности как минимум вдвое. кроме интерьера, здесь, конечно, есть книги. магазин славится своей большой коллекцией работ фердинандо пессоа - конечно, только здесь, только выйдя из-под стеклянного расписного потолка, только в толчее людей, только в солнечный пасмурный день в городе порту можно начинать читать книгу непокоя. если у вас не получилось в первый раз - можно попробовать снова, там.;https://www.comerciocomhistoria.gov.pt/wp-content/uploads/import/listings/3351_imagem2.jpg;https://www.livrarialello.pt/en-us/
dominicanen;в маастрихте есть книжный магазин, расположенный в старой доминиканской церкви. сейчас, после реставрации интерьера, полного фресок, здесь можно найти second-hand и новые книги на любой вкус - нужно или хорошо говорить по-голландски, или запастись терпением и найти секцию английской литературы. а пока вы ищете, не забывайте поднимать голову к потолку и размышлять о всем, о чем положено думать в церкви: спасение, божественный свет, горячие булочки из ближайшей пекарни. ;https://travelissimo.sk/wp-content/uploads/2016/06/DSC_0726.jpg;https://www.libris.nl/dominicanen
atlantis books;укромный книжный магазин в подвальном помещении одного из белоснежных домов острова санторини. здесь вы можете найти литературу на семи языках - новые и уже «полюбленные» другими книги. конечно, кроме книг, здесь еще предлагают ветер от ближнего моря, прохладу подвала в горячий день и вечный запах вина, соли и инжира.;https://images.gr-assets.com/misc/1447973090-1447973090_goodreads_misc.jpg;http://atlantisbooks.org
alexandra book cafe;удивительное место в будапеште, совмещающее в себе шарм классических интерьеров и все возможности современного книжного магазина. здесь у вас есть возможность после покупки книги уединиться с ней (кофе, и, возможно, пианистом) под сводами прекрасного здания. ;https://daauxcge0bfi7.cloudfront.net/photo/crop/5wrw8bhjpf_720x460.jpg;https://www.facebook.com/lotzterembookcafe/
